{
  "$schema": "../schema/market-manifest.schema.json",
  "schemaVersion": "2.0.0",
  "generatedAt": "2026-07-14T00:00:00Z",
  "manifest": {
    "id": "LanMountainDesktop.YourPlugin",
    "name": "Your Plugin",
    "description": "Describe what this plugin adds to LanMountainDesktop.",
    "author": "Your Name",
    "version": "1.0.0",
    "apiVersion": "5.0.0",
    "entranceAssembly": "LanMountainDesktop.YourPlugin.dll",
    "runtime": {
      "mode": "in-proc"
    },
    "sharedContracts": [],
    "tags": ["example"],
    "releaseTag": "v1.0.0",
    "releaseAssetName": "LanMountainDesktop.YourPlugin.1.0.0.laapp",
    "releaseNotes": "Initial PluginSdk 5 release."
  },
  "compatibility": {
    "minHostVersion": "0.8.6",
    "apiVersion": "5.0.0",
    "sharedContracts": []
  },
  "repository": {
    "iconUrl": "https://raw.githubusercontent.com/owner/YourPlugin/main/Assets/icon.png",
    "projectUrl": "https://github.com/owner/YourPlugin",
    "readmeUrl": "https://raw.githubusercontent.com/owner/YourPlugin/main/README.md",
    "homepageUrl": "https://github.com/owner/YourPlugin",
    "repositoryUrl": "https://github.com/owner/YourPlugin",
    "tags": ["example"],
    "releaseNotes": "Initial PluginSdk 5 release."
  },
  "publication": {
    "releaseTag": "v1.0.0",
    "releaseAssetName": "LanMountainDesktop.YourPlugin.1.0.0.laapp",
    "downloadUrl": "https://github.com/owner/YourPlugin/releases/download/v1.0.0/LanMountainDesktop.YourPlugin.1.0.0.laapp",
    "sha256": "0000000000000000000000000000000000000000000000000000000000000000",
    "packageSizeBytes": 1,
    "releaseNotes": "Initial PluginSdk 5 release.",
    "packageSources": [
      {
        "kind": "releaseAsset",
        "url": "https://github.com/owner/YourPlugin/releases/download/v1.0.0/LanMountainDesktop.YourPlugin.1.0.0.laapp"
      },
      {
        "kind": "rawFallback",
        "url": "https://raw.githubusercontent.com/owner/YourPlugin/main/LanMountainDesktop.YourPlugin.1.0.0.laapp"
      },
      {
        "kind": "workspaceLocal",
        "url": "workspace://YourPlugin/LanMountainDesktop.YourPlugin.1.0.0.laapp"
      }
    ]
  },
  "capabilities": {
    "sharedContracts": [],
    "desktopComponents": [],
    "settingsSections": [],
    "exports": [],
    "messageTypes": []
  }
}
